{
  "schemaVersion": 1,
  "taskId": "2026-08-20-fix-mermaid-false-render",
  "type": "bug",
  "updatedAt": "2026-08-22T01:34:50.938Z",
  "stages": {
    "requirements": "completed",
    "design": "completed",
    "implementation": "completed",
    "verification": "in_progress",
    "consolidation": "pending"
  },
  "pullRequest": null
}
