{
  "schemaVersion": 1,
  "taskId": "2026-08-24-automated-development-workflow",
  "type": "feature",
  "updatedAt": "2026-08-24T05:00:15.681Z",
  "stages": {
    "requirements": "completed",
    "design": "completed",
    "implementation": "completed",
    "verification": "completed",
    "consolidation": "completed"
  },
  "pullRequest": null
}
