{
  "schemaVersion": 1,
  "taskId": "2026-08-25-fix-harness-kit-review-findings",
  "type": "bug",
  "updatedAt": "2026-08-25T02:47:08.406Z",
  "stages": {
    "requirements": "completed",
    "design": "completed",
    "implementation": "completed",
    "verification": "completed",
    "consolidation": "completed"
  },
  "pullRequest": null
}
