{
  "schemaVersion": 1,
  "taskId": "2026-08-21-secure-agent-tools",
  "type": "bug",
  "updatedAt": "2026-08-22T12:25:43.263Z",
  "stages": {
    "requirements": "completed",
    "design": "completed",
    "implementation": "completed",
    "verification": "completed",
    "consolidation": "completed"
  },
  "pullRequest": null
}
