{
  "schemaVersion": 1,
  "taskId": "2026-08-22-agent-chat-new-conversation",
  "type": "bug",
  "updatedAt": "2026-08-22T13:52:07.693Z",
  "stages": {
    "requirements": "completed",
    "design": "completed",
    "implementation": "completed",
    "verification": "completed",
    "consolidation": "completed"
  },
  "pullRequest": null
}
