{
  "schemaVersion": 1,
  "taskId": "2026-08-16-agent-chat",
  "type": "feature",
  "updatedAt": "2026-08-16T02:16:19.787Z",
  "stages": {
    "requirements": "completed",
    "design": "completed",
    "implementation": "completed",
    "verification": "completed",
    "consolidation": "completed"
  },
  "pullRequest": null
}
