{
  "schemaVersion": 1,
  "taskId": "2026-08-19-kit-config-layers",
  "type": "feature",
  "updatedAt": "2026-08-19T16:03:25.974Z",
  "stages": {
    "requirements": "completed",
    "design": "completed",
    "implementation": "completed",
    "verification": "completed",
    "consolidation": "completed"
  },
  "pullRequest": null
}
