{
  "schemaVersion": 1,
  "taskId": "2026-08-07-local-web-file-open",
  "type": "feature",
  "updatedAt": "2026-08-07T04:21:04.283Z",
  "stages": {
    "requirements": "completed",
    "design": "completed",
    "implementation": "completed",
    "verification": "completed",
    "consolidation": "completed"
  },
  "pullRequest": null
}
