{
  "schemaVersion": 1,
  "taskId": "2026-08-07-offline-kit-attestation",
  "type": "bug",
  "updatedAt": "2026-08-07T04:09:27.149Z",
  "stages": {
    "requirements": "completed",
    "design": "completed",
    "implementation": "completed",
    "verification": "completed",
    "consolidation": "completed"
  },
  "pullRequest": null
}
