{
  "schemaVersion": 1,
  "taskId": "2026-08-15-web-only-host",
  "type": "refactor",
  "updatedAt": "2026-08-15T12:09:40.714Z",
  "stages": {
    "requirements": "completed",
    "design": "completed",
    "implementation": "completed",
    "verification": "completed",
    "consolidation": "completed"
  },
  "pullRequest": null
}
