{
  "schemaVersion": 1,
  "taskId": "2026-08-22-agent-chat-draft-render",
  "type": "bug",
  "updatedAt": "2026-08-22T14:29:27.428Z",
  "stages": {
    "requirements": "completed",
    "design": "completed",
    "implementation": "completed",
    "verification": "completed",
    "consolidation": "completed"
  },
  "pullRequest": null
}
