{
  "schemaVersion": 1,
  "taskId": "2026-08-19-plugin-broadcast-topic-ownership",
  "type": "feature",
  "updatedAt": "2026-08-19T12:41:44.696Z",
  "stages": {
    "requirements": "completed",
    "design": "completed",
    "implementation": "completed",
    "verification": "completed",
    "consolidation": "completed"
  },
  "pullRequest": null
}
