{
  "schemaVersion": 1,
  "taskId": "2026-08-26-user-feedback-toast",
  "type": "feature",
  "updatedAt": "2026-08-26T07:30:08.637Z",
  "stages": {
    "requirements": "completed",
    "design": "completed",
    "implementation": "completed",
    "verification": "completed",
    "consolidation": "completed"
  },
  "pullRequest": null
}
