{
  "schemaVersion": 1,
  "taskId": "2026-08-21-agent-streaming-cancellation",
  "type": "feature",
  "updatedAt": "2026-08-22T12:59:13.235Z",
  "stages": {
    "requirements": "completed",
    "design": "completed",
    "implementation": "completed",
    "verification": "completed",
    "consolidation": "completed"
  },
  "pullRequest": null
}
