{
  "schemaVersion": 1,
  "taskId": "2026-08-20-chat-final-response",
  "type": "bug",
  "updatedAt": "2026-08-22T04:12:27.928Z",
  "stages": {
    "requirements": "completed",
    "design": "completed",
    "implementation": "completed",
    "verification": "completed",
    "consolidation": "completed"
  },
  "pullRequest": null
}
