{
  "schemaVersion": 1,
  "taskId": "2026-08-24-rename-agent-chat-harness",
  "type": "refactor",
  "updatedAt": "2026-08-24T12:43:27.415Z",
  "stages": {
    "requirements": "completed",
    "design": "completed",
    "implementation": "completed",
    "verification": "completed",
    "consolidation": "completed"
  },
  "pullRequest": null
}
