{
  "schemaVersion": 1,
  "taskId": "2026-08-07-permission-risk-contract",
  "type": "refactor",
  "updatedAt": "2026-08-07T08:54:29.888Z",
  "stages": {
    "requirements": "completed",
    "design": "completed",
    "implementation": "completed",
    "verification": "completed",
    "consolidation": "completed"
  },
  "pullRequest": {
    "number": 67
  }
}
