{
  "schemaVersion": 1,
  "taskId": "2026-08-06-framework-esbuild-linux-install",
  "type": "bug",
  "updatedAt": "2026-08-06T10:49:40.525Z",
  "stages": {
    "requirements": "completed",
    "design": "completed",
    "implementation": "completed",
    "verification": "completed",
    "consolidation": "completed"
  },
  "pullRequest": null
}
